Id,Score,Date,Title,Review
480515727,30,"May 1, 2017","Cool setting, poor service - avoid the tasting menus","We bought the full six course Chef's menu with wine pairings and expected decent service. It is apparent they are putting their effort into the food, including fresh vegetables from their garden, but the staff lacked training, and there was no apparent supervision on the floor. The wine pairings were always served after we were already eating the course (once almost finished), the wine pour sizes were very inconsistent, our water and wine glasses were empty four different times during the meal, and at one point I was thirsty enough to get up and walk across to where they had our sparkling water to pour a round for our table myself. No one came to interrupt me from doing so, which told me they lack supervision. For us, this problem and a lot of waiting between courses took away from enjoying the food, although it was quite well prepared. They need to remove the five and six course tasting menus or refocus on their service. It wasn't expensive, but overall I have to give them an average score."
479710367,50,"April 28, 2017",Gourmet dishes with a nice look,"This is the second time I visit this top restaurant of Amsterdam. Last time (a year ago) I tried ""chef's table"" which is more interesting from a gastronomical perspective, but can be a bit lonely if your company is not too interesting. This time I tried the 6-course dinner including wine package. One can with no doubt say that the wines are not up to the standard of the food. Anyhow, me and my 4 guests liked to sit in the nice eating hall with all tables full of activity and people. I will come back some day!"
479635162,50,"April 27, 2017",An out of the way food adventure,We had dinner here on our last night and it was a great way to cap off a very memorable Amsterdam experience. The menus are prixe fixe and in the 50 euro range for four courses. It's farm to table and the food was excellent. Needless to say the restaurant was packed and we had made the reservations approx. 2 month's earlier. We went to a lot of great restaurants in Amsterdam and we felt this was the best. Dinner for 3 including a bottle of wine and tip was approx $210 euros.
479469279,50,"April 27, 2017","Interesting, unusual and excellent",The freshest food in this buzzing greenhouse restaurant is beautifully prepared and presented. Friendly staff cope well with the large number of diners.
478974900,50,"April 25, 2017",Greenhouse Dinning,Terrific avant garde fix prix dinner in very eclectic setting. Worth visiting. Try to get the table in the kitchen for up close chef work.
478730221,50,"April 24, 2017","Fun setting, creative food","Dined here with friends, hard to get a reservation, great setting inside remodeled city greenhouses. Very friendly, attractive, helpful staff. The food is locally sourced, organic, very creative combinations which change each day.We had braised chard with small bites of rose tenderloin, baked endive with gremolata,slow cooked chicken with white adperagus & radish, a delicious dessert of Rhubarb compote, elderflower ice cream & almond crumble.Would return often if possible!"
478056255,50,"April 22, 2017",Best Meal Ever,"Excellent ambiance, great service and amazing farm to table food. We opted for the wine pairing and would highly recommend it to anyone."
477680992,50,"April 21, 2017",Excelent food and accomodation,I have been to ' de kas' now for two times and each time I love the food. The price/quality rate is perfect. Its not a cheap place to eat but the quality of the food is amazing. Additional the greenhouse itself is beautiful and its a great to go to with friends or for business purposes.The staff is great in their service and I would recommend the restaurant to everyone.
477195274,40,"April 19, 2017","Nice food experience, great location","I went to De Kas with my girlfriend for dinner and we had an interesting food experience. We had a 5 course meal, 2 meat, 2 vegetarian and one desert. Even i am a meat guy, i can say that all the dishes were good and the fact the De Kas grows it's own veggies gives a great taste to everything in your plate. It was one of the most interesting meals i had, and even if the dishes are quite small, at the end i felt full. For and different food experience, try De Kas, i am glad i did it."
477077488,50,"April 19, 2017","Pricey, but totally worth it!","My girlfriend and I planned a dinner at De Kas after hearing a recommendation from one of our friends. Although there is a high price tag, it is well worth it considering the caliber of food that you will be eating here. This is a great place to go to if you are looking to step outside of your comfort zone and have the chef surprise you. Also, we felt great after the meal even though we were full, mainly due to the high quality ingredients that go into this meal. Overall, a great and delicious meal!"
476950245,50,"April 18, 2017",Amazing greenhouse restaurant,This restaurant is like no other! Its housed in a 1920's greenhouse. It's absolutely beautiful and the food is delicious. Some of the produce is grown on site too. The smell of growing tomatoes when you walk into the restaurant is unforgettable .You cannot chose individual dishes to eat but you are served the menu of the day with their home baked bread . They will accommodate any dietary requirements . The staff are charming . There is a good wine selection . This is a perfect venue for an understated sophisticated celebration!
476894204,50,"April 18, 2017",Great food at a nice location,"The food was great, and we are glad we took all six dishes, even though we were very skeptical of the fresh cheese dish, it turned out to be the best one, and they were all good.Service was good. Attentive and friendly staff. Thank you Benjamin, and the rest of you, for making the visit enjoyable."
476888352,50,"April 18, 2017",Fabulous experience,"We had lunch here and enjoyed true experience immensely. There was a set menu, but everything on it was very good. I opted for the wine pairing and tried some very pleasant wines that matched the food very well. Every dish was well thought out, and prepared using vegetables from their own garden. Lovely atmosphere, and he dining room is much nicer in real life than I thought it would be from the photos. Will definitely go back when I visit the city again. Thank you!"
476004644,50,"April 16, 2017",This is a must try when in Amsterdam,Gourmet food and unique surroundings with friendly services.Fixed menues combined with respect for seasonal ingredients. Don´t miss this restaurant while in Amsterdam
475841942,50,"April 15, 2017",A must when you are in Amsterdam!!,We had a truly memorable and exceptional dinner at De Kas ... We are spoiled New Yorkers and De Kas ranks as one of the best restaurants we have ever eaten at!I am shocked to read another reviewer called it pretentious! The staff from start to finish could not have been more pleasant and delightful! The food was nothing short of superb! The setting was exciting!!This restaurant is not to be missed!!
475826076,50,"April 15, 2017",Perfect lunch spot,This beautiful greenhouse/restaurant in the middle of a park was a wonderful find. Delicious home-grown produce on the fixed menu was creatively prepared and presented. A little outside of the central Amsterdam area but well worth the trip! Advance bookings necessary.
475804079,50,"April 15, 2017",Amazing every time,"This is one of my favourites restaurants anywhere. Coming here is more of an event. There are two new chefs and you still get the tasting menu, but now you can read what u are getting before hand! The service as always is very attentive. The food was just sublime. Every course was incredible. A feast for the senses. We also had an incredible red wine that the sommelier recommend. Can't wait to go back!"
475588107,50,"April 14, 2017",Unforgettable,"I heard De Kas is a very good option for dinner but I couldn't imagine it's that good. Food is delicious in a very insteresting location with very kind staff. Reservation is not easy, but It worths. One menu, two options, that's It."
475128413,10,"April 12, 2017","Extremely disappointed, we won't be back.","This place has really gone downhill. We had an extremely disappointing meal last night. After having several fantastic meals there in the past, the disappointment of it not being up to scratch was magnified. I would give it a zero if that was possible. Tiny portions of weed which I could have picked off the sidewalk with a tasteless dressing for the starter. The second dish tasted good but was just like a miniature version of something you might find in the most basic Lebanese restaurant served with a fork in a deep bowl which made it impossible to scoop up the final mouthfuls of what was already a pitiful looking amount. The main was completely unimaginative, again a tasteless sauce and not even cooked properly. The same goes for the dessert. The rhubarb was sour, hard and served with a spoon making it very impractical to eat. Apparently, the concept has changed recently which accounts for the totally different experience to what we had on previous occasions. The waiter tried to compensate with free coffees at the end and after asking for it we also got a free after dinner digestif but this is a small token given the extortionate cost for the overall dining experience. Extremely disappointed, we won't be back."
474755148,50,"April 11, 2017",A wonderful evening's gourmet celebration,"Despite initial hesitation re capacity, four of us sampled six diverse, interesting and quite delicious courses over a couple of relaxing and engaging hours. I would highly recommend a visit to De Kas as a special treat."
473365413,50,"April 7, 2017",Amazing experience!,I loved every bite I tried on the chef's 6 course dinner menu! It was a great culinary experience and the servers made it extra special. The food is what is most memorable and we can honestly say it was one of the BEST dinners we have ever had. A lot of thought was put into each dish and I loved that we could get a peak into the kitchen with the chef working hard.I was in Amsterdam to kick-off my European honeymoon and wanted a special dinner with my husband and they delivered on every aspect! :) The server surprised us with glasses of sparkling wine and a special dessert treat to help celebrate our honeymoon. I'm so glad I was recommended to go to this restaurant and I highly recommend it!!The setting was so different than the rest of the city of Amsterdam that we were exploring . It is located on a green park with its greenhouse right next door. After our meal we walked around to look at the nursery and it was cool to see some of the herbs and veggies that were used in our meal freshly planted.
472843147,30,"April 5, 2017",Pretentious,"The ambiance and setting are very nice in the restaurant. We had 6 dishes menu but we find it pretty weak in terms of taste and originality. The staff is kind but don't know about their wine menu. So after all, it was ok."
472642779,50,"April 4, 2017",Lovely exceptional dining experience,My friend and I were visiting from the US . We were able to book a table for lunch at this amazing farm to table Resturant . We had the pleasure of Zander as our waiter. The food along with the wine pairing and explanationfrom Zander was outstanding . A real FINE treat.
472426321,30,"April 3, 2017",Dinner at an unexpected place,"The location of the restaurant is very tranquil and the decor of the restaurant is really nice and special, because you are actually dinning in a greenhouse, where they even cultivate their own vegetables and herbs, which are also used in the food. When fully seated, it can be a bit loud as it is just one big space with a high ceiling. The service was friendly. They only serve one menu. The dishes had fresh flavors and were not bad, but I expected something more. The wine pairing was not so good, the wines did not go with the food to well, which was a bit of a miss. The price quality ratio is in my opinion a bit off."
471787490,50,"March 31, 2017",Phenomenal meal,"Excellent meal from beginning to end. Very creative ingredient combinations, everything prepared perfectly. Chèvre mousse was one of the best things I have ever eaten in my life. Very attentive (but not overly) staff made for a very pleasant evening. Just do not schedule anything for afterwards as it took a few hours."
471123400,50,"March 29, 2017",One of those meals that you remember for a lifetime!,"Without exception, this was the finest meal of our recent European trip, and one of the best meals we have ever had! The setting, in a greenhouse in a park, sets the mood for the evening. The service was friendly and professional. The food was sophisticated and deftly prepared, mostly from the fresh ingredients grown locally (some very locally, in the greenhouse itself!). The wine pairings were flawless. I will always remember the beetroot dish, the mushroom tea, and the goat cheese foam cheese course. It was all truly exceptional. If you find yourself in Amsterdam, do yourself a favour and go to De Kas!"
470870010,50,"March 28, 2017",One of the best meals I've ever had!,"This place is just stunning. The restaurant is in a green house with lots of light and just around the back they grow their very own produce. The food they served us was so fresh and delicious, there's not enough words to describe how much we enjoyed the experience! Something we also absolutely loved is that you didn't get to choose what you were going to have but instead you were surprised with a stunning dish. My friend is vegetarian as well and they were very accommodating. Highly recommended and worth every penny!"
470506705,50,"March 27, 2017",Fine dining in the greenhouse,Had an absolutely fabulous meal at de kas - the setting of the greenhouse was amazing and the service was incredible. Every course was delicious and although a bit pricey worth every penny! We didn't go for the wine pairing but had a delicious Dutch gin with Tonic!It's worth booking at least a month in advance - we were lucky enough to get a cancellation reservation. The menu is set and there is 5 or 6 course options - when you have 5 course the cheese course is usually the one that is left out though we were told if we really wanted the cheese another could be left off. We even got some apples when we left which we're grown in the greenhouse :) it also worth having a little look around the greenhouse afterwards!
469233424,50,"March 21, 2017",Superlative,"We are foodies and this was our splurge while spending a week in Amsterdam. The quality of the food and the sophistication of the preparation was in the top 5 I've ever eaten. The two chefs are new (March 2017) but they arrived from a restaurant that just earned its first Michelin star and I understand why. The restaurant is fixed menu and they grow the majority of the ingredients at their farm, otherwise they source it locally. The service was very efficient, if not necessarily friendly. But I cannot get over how well you could enjoy every spice and every flavor. The dishes were sooooo well balanced."
468725234,40,"March 20, 2017",Amazing evening!,"I decided on ""The Kas"" which is an old greenhouse that has veen converted into a restaurant.The food was amazing and the actual gtounds at night look awe inspiring.Definitely worth a visit.I am only giving them 4 stars as I feel that there is no signage or info to show you how to get o the restaurant with a car. ( we drove around trying to find it- turns out you need to park in the street or take a cab.Other than that an amazing anniversary evening."
468511289,50,"March 19, 2017",Lovely Meal,"We organised a birthday meal for a friends 21st and it was a lovely meal. The food was delicious and a really interesting selection of dishes,"
468202904,50,"March 17, 2017",Lovely dinner in a beautiful restaurant,"The restaurant, which is in a huge glass greenhouse, is stunning. The focus is on vegetables, some of which are grown on the premises or brought in from farms in the Beemster area. All of the courses were lovely and the service was attentive. The waitstaff describe the components of the dishes in detail. It's a bit of a way outside of Central Amsterdam, but well worth the taxi fare. Highly recommend this restaurant."
467656957,50,"March 15, 2017",Outstanding Special Birthday Dinner,"I booked this restaurant on the back of the reviews and the fact we wanted to try something a bit different. We had booked for 19:30 but due to a delayed flight we had to call and push the reservation back over an hour. Considering how busy they were, this was absolutely no problem.The staff and service was absolutely superb right from our arrival. George, in particular, made us feel like old friends. Under his guidance we decided not to look at the 6 course menu until after we had finished our meal. I would highly recommend this as it was wonderful having each course served and really tasting the different flavours and textures. A small gap in between each course allowed us to relax and really take our time to savour the whole experience. What stood out about the food was how fresh, different and delicious it was.When thinking about this restaurant it's more than going out for a meal, it's the full experience that makes it so special.Thank you George and the team."
467345493,50,"March 14, 2017",Amazing food and fantastic staff,"We arrived here on the wrong day of our reservation, couse we written down the wrong date.Luckely we didn't go there for nothing. The staff quickly arranged a table for us at the long table where a couple of 3 with a baby were sitting at the other end.We orderd the 3 course meal and wine parring.All the way through the 3 meals we were possitivly supprised and could only compliment it and went really good with the wine.The dish that supprised me the most was the toast with sardin, spinach and sennep. I must admit im not into sardin or sennep at all and never been a positive experience.But this dish was over all expectations and finished it all.The best dish we had was duck and spinach soup with had a fantastic texture and great flavour.My friend and i ended up getting a tour in the garden. We will definitly come back and even might go for ""Chef's Table"""
467135476,50,"March 14, 2017",different than others!,"Most definitely must do in Amsterdam!Way different than other places, biological food they even have own farm next to the restuarant, excellent ambience. The restaurant is located in the middle of the park in the former ""greenhouse"".One of the ""Must do in Amsterdam"", the only thing is that they are most of the time fully booked so is good to consider booking at least one month in advance!"
467121593,50,"March 13, 2017",Excellent dining experience,"The former glass house turned restaurant is located in a park. We selected the five course set menu. Each course was just excellent. The staff was friendly, attentive and were happy to inform us about each course and show us around. Highly recommended."
467118763,50,"March 13, 2017",The most exciting tasting experience I have ever had,"I cannot say enough good things about this beautiful restaurant - what it offers is an experience, rather than just good food. The tables are inside a lovely large greenhouse, and the setting is spare but beautiful - just perfect to concentrate on the creative and delicious food that comes from the chefs. The waiters are informative, friendly, but not overbearing or pompous, and the food - well, it must be tasted to be believed. Set menus focus on seasonal ingredients prepared in exciting and unusual ways, and the pairing with the wine tasting menu makes an experience you will never forget."
464959758,50,"March 6, 2017",A must do in Amsterdam,"De Kas is an experience in itself. The effect of sitting in a lofty greenhouse is dramatic.However, the standard three course dinner (including the starter which itself consists of three dishes) is also worth going for. Taste, texture, presentation are all top class. We opted for the wine menu and were not disappointed. Really good welcoming and attentive staff."
464715209,50,"March 5, 2017","ambience excellent, food amazing","A wonderful restaurant with excellent attention to detail. The food is exquisite and very largely based around vegetables. I went with a vegetarian who adored the atmosphere, food and very attentive service. A must for those visiting Amsterdam"
464487470,50,"March 4, 2017",It Blew my mind away,"Amazing service, deliciuos food and over all the experience is incredible. Every single plate is a work of art. I didnt want to leave. The menu is set based on what is available on there farm the day to reserve, so be prepared to be surprise and enjoy the amazing atmosphere."
463552772,50,"February 28, 2017",A fresh take on fresh food,"It's not as central as the other restaurants we went to during our stay in Amsterdam, but the setting is beautiful and worth the extra stops to get there. The greenhouse has been beautifully preserved, and looks like a jewelry box from the outside at night. Some of the food is grown right on the premises (we walked through the working greenhouse to see and even taste the lettuces and herbs growing in the winter), and the rest is grown at their garden just a couple hundred meters away. There are no decisions: the chef makes whatever is growing, in creative, gastronomical ways. It was a real experience and the staff was kind and knows their stuff when it comes to wine."
463259442,40,"February 27, 2017","Exquisite Food, Service and Surroundings","My family took me here for my birthday celebration and celebrate we did!!! The menu was pleasing and changes with the season. They accommodated the Gluten Free, Vegetarian and Pregnant family members by asking up front what allergies or dietary restrictions we have.All the food brought to us was outstanding and service almost impeccable - they forgot to bring our wine flight with dinner and had to be reminded. Also one meal which was supposed to be GF had to be brought back as the garnish had Gluten on it. We forgive the wait staff for these minor issues but these mistakes reduced the ratings by a notch!!!Because my family brought gifts, the service realized it was my birthday and brought me a special decorated dessert which was well received."
462390566,50,"February 23, 2017",Chef's table,My wife took me here as a surprise birthday present and we ate at the chef's table. I loved it. The food is made with such care and attention. The staff clearly love working there. I recommend the tasting menu and the accompanying wines.
462139505,50,"February 22, 2017",Different but worth it,"Went for a meal on a business trip. The greenhouse has many different types of vegetables growing, each course you have has a host describing what your eating and how local it is, you can also get a tour of the greenhouse . Lovely place, lovely meal."
461550147,50,"February 20, 2017",Fabulous,"We arrived slightly early for our dinner reservation but we were still accommodated.The room is gorgeous, warm glowing feeling.I have a few allergies which they repeated back to me but sadly missed, however the amendments required were hastily made.A fabulous and memorable meal had by our family in a beautiful setting. Well worth the expense!"
458883409,50,"February 12, 2017",The place to be when you're looking for service and healthy organic food!,"Great overal experience! Being around for 16 years, this place is one of the best places to include in your Amsterdam visit.Dining in a greenhouse, organic food, friendly staff as a matter of fact compared to most Amsterdam restaurant you are made feeling very welcome and taken care of. My party of two had quite a list of food allergies and the chef and it seemed the total serving staff where aware and altered the menu on the spot.We where invited to check out the part of the greenhouse where they grow their vegetables, amazing!I highly recommend this place."
458627988,40,"February 11, 2017",Impressive,"I choose the place for meeting with our dealers (came to Amsterdam for ISE) and it was the right choice :) Excellent service, unusual manner of serving dishes, no mistakes with food preferencies (several vegetarians and muslims). It would be a nice place for a business presentation or a party - several separated rooms, nice views and surroundings."
457925724,50,"February 7, 2017","An excellent, esoteric meal.",We entered the conservatory and were greeted warmly. The meal was a set menu. Each were complex but masterful flavors. I can think of nothing we weren't satisfied with. It was top notch. Excellent in every way.
455314828,50,"January 27, 2017",Liked it,We went with a group at a business trip. Service was fast friendly and as it had to be. The menu as I understood is always set at all times so there is no menu to choose but I am not 100% sure. Presentation and taste was excellent. I liked the friendly young water we had and the greek cook that presented the menu.
455274663,50,"January 27, 2017",Great experience,"Great space, excellent service and fantastic food, if you want a memorable gastronomic experience at a reasonable price this is a restaurant you won't want to miss."
454012708,40,"January 22, 2017",Brilliant,Top notch food but also high prices. All the vegetables and fruit are supplied through the kas's own greenhouses around the country. The setting is charming.
