Id,Score,Date,Title,Review
297678360,50,"August 10, 2015",One of the most memorable meals of my life,"Two well traveled friends each recommended this spot and we are so glad. Made an on line reservation in advance but was already limited to the one night they still had available during our trip. So book ahead. The restaurant is inside a nursery, all glass and beautifully designed. In frontt and back are gardens where they grow produce and flowers in addition to a larger off site farm. The menu is unpublished and changes each week...my husband is vegan and all accommodations were made. Each of three courses was exceptionally delicious and so beautifully displayed. Truly works of art. You can taste the fresh vegetables and flowers....every aspect is considered. Highly recommend and try to go during day light if possible for full effect. We are from NYC so the price was profoundly reasonable for this level of quality and experience."
297003532,50,"August 8, 2015",One of the best meals of my life.,"We reserved the chef's table for one evening during our trip to Amsterdam. I can honestly say it was one of the best meals of my life. We were seated at a lovely table in the kitchen and could see the chefs as they worked. The chefs were gracious and welcoming; each one introduced the dish they had personally prepared and told us about the ingredients and their local sources. The sommelier was friendly and knowledgeable (and generous with the pours for the wine accompaniments!). We had a post dinner tour of the restaurant's greenhouses and gardens (where most of the fruit and vegetable ingredients come from) before returning for dessert.We were probably there for about 4 hours altogether, never rushed as we enjoyed our long multi course meal. The food was fresh, beautifully prepared, and delicious. The surroundings are gorgeous--it's really something to be dining in large converted glass greenhouses in the middle of a beautiful park!I still can't believe what a good price we paid for a truly premium meal and experience. We were so impressed with the obvious pride everyone had in their restaurant. We would definitely go back."
296960393,40,"August 8, 2015",Worth the visit,"A very unique restaurant located in the middle of a park. The structure is a glasshouse where they grow and serve their vegetables. The service is top-notch as well as the ambiance. Set menu which understandingly revolves around greens. Very good courses but not memorable. Worth the visit and the price for the surroundings, staff, and uniqueness. Don't miss the stork's nest across from the entrance."
296832477,50,"August 8, 2015",Surprise food in an amazing location!,Beautiful place and great concept! The menu changes according to what the restaurant has grown so you don't know what you're going to get. It was nice to be surprise and all dishes were amazing. Lots of new tastes and excellent quality!
295253843,50,"August 3, 2015",Fabulous food and setting,We had lunch here on a hot day and it was amazing. The menu was a set menu centred on fish which one of our party can't eat. They added some vegetarian dishes to our meal with ease and they were some of the stars of the show. This is a fabulous place to experience the freshest home grown vegetables cooked with Michelin finesse to produce dishes that demand oohs and aahs. We were on the terrace but the interiors looked super stylish - will definitely return for dinner.
294965678,40,"August 2, 2015",very good food and relaxing ambience,"My husband and I had dinner there with a friend. It was really good. The service was impeccable. The food was very fresh, mostly seafood and veggies (from their garden). The wine pairing was also very good. We were surprised to find the sparkling white wine from The Netherlands really good and also the Austrian red wine.You have to book a week in advance, though as the place is quite famous."
293900141,50,"July 29, 2015",Greenhouse dining,"We cycled to this very elegant greenhouse restaurant outside the city center of Amsterdam. It was the one time I felt overtly under-dressed in Amsterdam. Smart casual might be the best way to describe the environment. The restaurant is in an underwhelming park, but its decor and food is well worth the trip out of town. The dining space is light, airy and modern. It is simple and bright. The wait staff is friendly. The food ample and innovative. I imagine it is even prettier by night than by day, but it was a very pleasant place to lunch, and when compared to Manhattan prices also a good value. I would not bring children here unless they are quiet, well mannered, and have a reasonably sophisticated palette. It isn't the right environment for a weed smoking, hemp hugging teenager in a deadhead t-shirt either. The staff is polite and casually friendly, but I think they take the food and the service seriously without being ostentatious about it. Diners are invited to explore the greenhouse, but must be mindful not to let the bees out - or in - I forget. We enjoyed two glasses of wine, but had been given enough food that cycling back to the city center was not a problem."
293411769,40,"July 28, 2015",Good dining experience !,"The restaurant is located right inside a park in Amsterdam, great atmosphere all around. The design is excellent, I loved the 'greenhouse' style and the glass roof/walls. The service was excellent, we were very impressed by a young man with blonde hair who took care of our wine order, he was very friendly and recommended different areas that we could visit. The food was 8/10, it was definitely tasty and fresh but the portions were quite small for their price. It is definitely recommended for a visit."
293340064,50,"July 28, 2015",Best place for farm-to-table fresh ingredient lunch with gourmet flare,"My husband and I are foodies, and we have to say one of the best meals we've had in Amsterdam! Enjoyed lunch on their beautiful patio overlooking the gardens. All fresh ingredients with gorgeous plating. Excellent wine as well. The only downside was my husband was craving a beer on a warm summer day, and they don't serve beer."
292352421,50,"July 25, 2015",Beautiful Setting and Meal at De Kas in Amsterdam,We enjoyed our experience at De Kas. The restaurant is outside the center of Amsterdam so it was a 10-15 minute taxi ride each way. The open dining room with light shining through the late evening (at 8:30 pm) created a really nice atmosphere and surroundings. The menu is fixed price and you are surprised with each course from beginning to end. We enjoyed each course and they were very accommodating with our gluten free diet restrictions as we also let them know in advance. The wine was our only extra cost. The service was very good as well as they described each course as they were served. We really liked the farm to table concept as well as the location being outside the tourist areas. You have an opportunity to walk the greenhouse so you may want leave some time to do that as well. The restaurant will call for a taxi for you and it will arrive within 5 minutes.
291368086,30,"July 22, 2015",Great atmosphere. Average food.,Very nice vegetables and ingredients. Quite simple. The combinations were not always that good though. We were 3 people.
291305941,50,"July 21, 2015",Beautiful setting and food,"Business trip of around 20 people and we were seated together in a large room next to the greenhouse ,we could see lots of ingredients being grown for the kitchen.The food was described as it came out as lots of ingredients were unknown or untried like flowers and cucumber ice cream.It was a good experience and the food was very good please visit this lovely park and enjoy the food."
290365815,50,"July 19, 2015",Sunday Lunch,De Kas was unusually open on the Sunday of our weekend trip to Amsterdam as it was mothers day there. Lucky for us as it was a very interesting and enjoyable meal. Lovely to walk around the garden and greenhouse to view the home grown produce and to discuss their philosophy with the staff. Had a lovely local sparkling wine as an aperitif.
290090852,30,"July 18, 2015","Overpriced, lost authenticity, highly tourist oriented","Been there several years ago a couple of times.The best that changed were the storks, that are now situated on a different chimney and can be viewed from the terrace.For a three course menu (the first course is split in three), aperitif (10euro's) wine arrangement, water, coffee, about 190 Euro's for two iis expensive. Especially when considering that all guests eat the same. This means very easy cooking and economy in acquiring ingredients.So one expects really something special. Although the food is OK it is not special, except the fact that all most ingredients come from the Beemster.We felt the compositions were also to complex in terms of taste, which made it a bit artificial. Also the personnel behaved friendly but also a bit artificial, at all tables exactly the same explanations were given, well rehearsed.So the place is not bad, but not authentic anymore (except the storks), they have unfortunately become an apparently highly appreciated tourist attraction, given the fact the are booked almost any night."
289528344,50,"July 16, 2015",Special meal in a special environment,"De Kas was recommended by friends, and it appeared on several lists of special restaurants in Amsterdam. We were not disappointed. From the moment we arrived and had cocktails on the patio to the final touches, everything was thoughtful, delicious, and well presented. The location should not be a deterrent. It was totally worth the trip to dine here. Go!"
289126387,30,"July 15, 2015",Not a good experience,"We heard so much about it. Unfortunately not a good night. Service was sloppy, food was just ok but lacking seasoning. Defenetely not what we expected. Unfortunately not a good night. Over priced. Sorry"
288961898,50,"July 14, 2015",Relaxing Treat,"We arrived at 7 and never left until after 10. The service was excellent, and we were made to feel as if we were the only ones being served; it was a very personable staff. The wine pairings were delicious. Amsterdam's own Bessen Jenever red dessert wine, paired with the beet chocolate cake and mint yogurt ice cream was perfect on a hot night. Being surprised by each course added to the fun. I can't say enough about this unique dining experience."
288862982,30,"July 14, 2015",Pretentious and expensive for what it is trying to be,"We had read about this restaurant at home in Italy and were very keen to try it for lunch yesterday, when we had finally found it! You can't see it from the road, as it is in a park over a little bridge. The buildlings, gardens and decor of the restaurant do not dissappoint, inside it is very stylish and bright with an open kitchen that you can look into, a beautiful bar area and excellent service. The very friendly waitress explained that there is no 'a la carte' and you cannot choose (very easy for the 'chef'!), the lunch menu costs €39 pp for two courses which seemed quite expensive to me. The starters (split in three?) consisted of a small cup of cold cucumber soup, a peace of toast with vegetables & goats cheese and a very small salad with grilled courgettes and ONE (??!)small mediteranian prawn or gamba plus a square piece of watermelon that seemed really out of place, like a fish out of water.... Then the fish, a pan fried skate, thin strips of tasteless white strings, neither of us wanted to eat it so we left it, but luckily the polenta and beans on the side were very tasty and the Italian white wine we had ordered was crisp. I did ask why they would serve skate as it is not a usual 'Dutch' fish, and being a scuba diver, I prefer to see all types of rays swim in the see not fried on my plate! They offered us the coffee on the house.... They were very nice but for a place that is trying to promote all their own home grown produce, they should try stay closer to home with their fish/meat choices and although all the dishes where presented very nicely, I still think for what they were & how they tasted, they lacked quality and were overpriced..... To top it all off we came back tot our car (parked along the road over the bridge, in a paid car parking area!) the rear window had been smashed in and a nice jacket (the only thing left in the car with any value....) had been stolen... So if we the €270 we have to pay for a new window to the €134 we spent at De Kas, it was a very expensive lunch indeed and one not to be repeated! So please, if you do visit 'De Kas' DON'T park along the Kamerlingh Onneslaan, but find a covered carpark instead!"
287538808,50,"July 10, 2015",wonderful birthday in de kas,"i was there with my husband and daughter in June 2015 for my birthday, we had lunch in a very cold day for June, the place amazing, food wobderful, people polite and friendly, price right. Don't miss the place."
287349162,50,"July 9, 2015",Wonderful Dining Experience!,"My husband and I went for lunch and it was such a great dining experience. Lovely service, atmosphere, design, and the food was incredible. The freshness and organic produce used in each dish, the presentation and the flavours were so good! You definitely need to make reservations as they fill up quickly, it is a set menu each day using their locally grown produce and fresh ingredients. My husband and I had this restaurant on our list for a while and we're so glad we were able to finally go, can't wait to return!"
286625810,50,"July 7, 2015",Second visit - just as excellent,this time we went to De Kas for lunch. Excellent food and service yet again. Fresh healthy food in a great building
286358671,50,"July 7, 2015",Memorable Birthday Dinner,"My friend and I had a wonderful meal at De Kas to celebrate my recent birthday. Beautiful setting, fresh and delicious food. I highly recommend this restaurant, especially for a special occasion."
285662433,40,"July 4, 2015",A wonderful Restaurant,"Nice pleasant restaurant, good food good service. We had dinner which is limited to a five course one menu cooked based on the days harvest. We had a selection between fish and duck, quite a busy restaurant so best is to get a reservation before you go."
284984781,50,"July 2, 2015",Our second visit was just as good as the first,"This is a wonderful place to spend an evening. The food is all grown in the surrounding greenhouses or else its locally sourced. The offerings are inventive and presented beautifully. In this restaurant you will be served what is on the menu for the day, you won't be able to pick your entree. However, they do have vegetarian options and will adapt their menu to any food allergies or dislikes. This is not a place for a meat and potatoes person. They will be disappointed. They will however, renew your love of fresh produce!"
284761379,50,"July 1, 2015",Worth the trip out of the main city,"We splashed out for the kitchen table and compared to some UK michelin star restaurants for their tasting menu the price is reasonable. From memory we paid around 120 euros each including the wine tasting.The restaurant booking online was simple and easy even though we don't speak dutch. The welcome was fantastic and the meal was very memorable. Sitting in the Greenhouse next to plants that have been picked to provide your dinner is a must for any food lover or gardener.We had a very enjoyable time here, with a superb information from the sommelier and the chefs. We were made to feel very welcome and each dish was presented beautifully and the flavours were fresh and everything was perfectly cooked. Highly recommend going in a season that suits the food you like."
284740085,50,"July 1, 2015",Class of 2015,"What a place to celebrate a big day! We were six people having a superb evening with 5 curse dinner, with short-traveled food, wine packet and very friendly staff. Topp food, wonderful location - and for a reasonable price. We'll be back."
284652979,50,"July 1, 2015",Foodies,"Highly recommend this restaurant. Best for people who love fresh veggies. My husband the steak and potato eater was not as pleased with it. The location is the ""Brooklyn"" of Amsterdam. Not a place to shop or go out, but a place where families move for me green space, but are still close to the city. The restaurant is in a green house where they grow the produce. Pretty cool. The peas are incredible."
284036589,50,"June 29, 2015",Beautiful and unique!,My husband and I dined at De Kas in July 2014. We biked from our hotel to the beautiful greenhouse right outside the city center. The ambience of the restaurant simply cannot be beat. Just gorgeous and full of natural light. The food was just as lovely -- beautifully prepared and locally sourced. A wonderful dinner in a wonderful setting.
283364792,50,"June 27, 2015",Organic yumminess in lovely setting,"Their card says: ""Harvest from the Tunnel Greenhouse"" and that about sums it up. You are dining IN a greenhouse. As you enter you will see gorgeous plants heavy with the bounty you are about to indulge in. I saw that there were peas on the vine and then there later appeared a cup of soup in front of me made of peas and other things from their produce. And it was delicious. We have eaten here on previous trips and it is a destination for us. The setting is GORGEOUS...it was raining when we were there and it just added to the ambience as the drops hit the glass. One of our party was a vegetarian and they accommodated her beautifully while we enjoyed roast chicken. My husband had eaten here the night before with biz associates and he said the offerings were equally delicious and completely different! The only issue I had was that we came with our 12 year old and they (like most high end restaurants) tend to want to seat people with kids at a crappy table. But my husband pointed out that he had made a reservation WAY in advance and had dined there the night before and requested a table in a certain area and the hostess, although not super sweet about it, did accommodate us. I won't let that drop my review to 4 stars but come on people. Stop trying to marginalize people with kids."
283259767,50,"June 26, 2015",Nice dinner in a light and airy greenhouse,One of our better meals in Amsterdam. The location is lovely. A working greenhouse in a park about 10 minutes from where we were staying - Vodelspark. Food was simply and nicely cooked making use of fresh ingredients some sourced from their greenhouse but mainly working with local suppliers. Had dinner with their wine pairings which was enthusiastically served. Only a set menu though so those with allergies or preferences should call the restaurant first. Nice !
282975473,50,"June 25, 2015",Garden delight,"Taking a friend known for being a fussy eater, the evening could have turned in to a disaster as I did not know when booking that De Kas served a set menu. I can eat anything so was rather pleased when every dish my friend was presented with was relished and I let out a joyful 'phew' each time we were were presented with 3 starters, 1 main course, followed by a dessertThe spanish olive oil and soda bread tasted of green grass and set the tone of quality to comeThe flavours of the delicate vegetables accompanying each dish - from long cooked veal cheak to barbequed chicken was a real delightDrinking a lovely Dutch sparking while the evening sun shone through the greenhouse setting, this topped off a lovely trip combining gourmet food with 17th century canal house and Rijkmuseum artA glamorous place with equally well groomed diners, the whole restaurant appeared to share in the collective satisfacion of excellent food and despite the gasp at the lack of choice my friend was as happy as I was and we would recommend without hesitation"
282946061,50,"June 25, 2015",very good,This restaurant was a nice meeting with excellent food. We really enjoyed the meal. We was on a bussinesstrip to Amsterdam and the company we visited took us here. It was the best restaurant we visited for this time in Amsterdam.
282703062,50,"June 24, 2015",Excellent,"I highly recommend this restaurant. Nice atmosphere, excellent food and service and a strong concept they truly live up to."
282517723,40,"June 23, 2015",LIVED UP TO ITS REPUTATION,"Two of my children (youngish adults) said we just had to go to De Kas as it is one of the most exciting restaurants they had ever visited, so it was with a great deal of anticipation that my wife and along with three friends went there for lunch in early May. The setting is great and we were blessed with a perfect Spring day to enjoy the building and its surroundings. You take pot luck with the food because it is a set menu of what is the best available on the day and again our luck seemed to be in because virtually everything that arrived was excellent. The service was very good as was the entire experience. I cannot say this is the best restaurant I have ever been to but it is certainly in the top five."
282363085,40,"June 23, 2015",Very nice place,"I was on a short trip in Amsterdam and had only possibility to have lunch here as on that day it was not possible to reserve a table for dinner. Overall my experience was good, the presentation of food, the place it self and the service was nice. The only comment I had about food was very much salt in the fish. Other then this everything was good."
281328015,50,"June 19, 2015",Organic dining in idyllic setting,About 20 mins ride in tram no. 9 from Central station and well worth the travelling time. They grow and supply organic vegetables for the restaurant - all dishes taste superb! The restaurant is set in a glasshouse in the centre of a lake - we were enjoying the dishes while looking at the grass swaying gently outside.
281148794,50,"June 18, 2015",Amazing experience!,The food was so natural and delicious and the service was sooo efficient!!!! The place itself is also gorgeous!!! Will definitely return!
281128201,50,"June 18, 2015",Perfection!,"Set in a park, a glass greenhouse with edibles growing just inside the door.. An auspicious beginning. The waiter was very happy to accommodate my request for a vegetarian meal and it was glorious! Savored every exquisite bite. Friendly service, beautiful ambiance, and a simply gorgeous dinner."
281074721,50,"June 18, 2015",A must visit,"This restaurant is a must-visit in Amsterdam. It's a little way out of the city, but we rented bikes and had a lovely ride out there for our lunch. We did the set menu, and every item served was perfect and unique. The food was 100% fresh and every bite had a really interesting mix of flavors. I loved walking around the outside and seeing the garden where a lot of their food is grown. You can tell a lot of care is put into the preparation. I also appreciated that it didn't feel pretentious, everything was explained to us and the staff was very friendly. It's a little pricey, but the location, design of the restaurant, and quality of the food is totally worth it."
280930194,50,"June 17, 2015",Second visit as good as the first!,This is our second time at this lovely restaurant. A great concept with greenhouses adjoining the restaurant. Everything is fresh and I believe the produce is all organic. Everything is grown there or locally acquired. Service is outstanding. The food is excellent and very unique. It will make you love vegetables if you don't already. But don't worry they serve meat as well. We will go back whenever we visit.
280459236,50,"June 15, 2015",Simply stunning,"We did our research before we went and De Kaas kept popping up:The venue looked stunning.The food offering described as unique.The reviews generally all favourable.So pedalling over to this park greenhouse, did it live up to expectations?It surpassed and more.Sunny Amsterdam evening sitting outside overlooking their beautiful park/herb garden. Sheer heaven.Service exemplary.Food; epicurean delight of several courses and exquisite wines to accompany.Price; better not to ask.An absolutely memorable evening at a truly magnificent and unique restaurant."
280350589,40,"June 15, 2015",Good for lunch,"Be ready for a new experience no menu as the food is dependent on the fresh ingredients they get from there green house and farm, but i have to say i loved it the food is so fresh and service is good"
280174641,50,"June 14, 2015",Lovely atmosphere with good food,"It's a fantastic place with warm and very friendly service and great food. I loved the greenhouse atmosphere with the nice lighting when the sun went down. The food was very good quality - Perhaps not the best I have ever eaten, but certainly very well tasting. The wine list was OK but of course rather pricey. Definitely my favourite place in Amsterdam so far."
278053564,50,"June 5, 2015",Absolutely brilliant,I cannot fault this place. Food was so fresh. Perfectly prepared and wonderful surrounding. I cannot fault it. And that is saying something. Don't miss this!!
277911178,50,"June 4, 2015",Amazing food,Lovely restaurant in a converted greenhouse/glasshouse. Held a conference dinner in one of the private rooms. The food was truly fabulous. All fruit and vegetables are grown in the greenhouses. The service was very good. Would love to return.
277908275,50,"June 4, 2015",Romantic and delicious,Went for our anniversary and had the chefs tasting menu; it was all delicious! Most veg is grown in the greenhouse our sorced locally... you can really taste the freshness. The restaurant is within a converted industrial greenhouse and finished to an impressive standard... looks pretty stunning at night
277591556,40,"June 3, 2015",good biological kitchen,he food is excellent and the food are individually well coordinated. a very good wine list. The staff is freundlich.die entire ambiente.good place to eat.
