Id,Score,Date,Title,Review
186012917,50,"November 26, 2013",An Remarkable Experience,"If you can only reserve one restaurant in Amsterdam, make it this one. De Kas, situated in an revamped nursery, was a destination to see as well as taste. We were hesitant to take public transportation so far out of town...super clean and fun. We were nervous about the single choice for dinner...delectable. The waiters were fun and the hostess came by several times to make sure everything was perfect. Our food was fresh, hot, (or cold) and tasty. The atmosphere was bright, clean, and sparkly. Coming from California, fresh, local food is expected. Don't forget to take an apple at the door on your way out...it was the perfect ending."
186011235,50,"November 26, 2013",Fantastic night out ... so tasty!,"My wife and I were in Amsterdam for 4 nights, and a friend recommended this place - its found in an old greenhouse that has been converted to a restaurant. It was lovely.We took the tram there, but on our walk in, we couldn't help but be impressed by the modern feel of the place. You pass the ""garden"" as you walk in (alas in November there wasn't much growing, but they later told us its usually full!)The front of house staff were really nice and warmly welcomed us, taking our jackets and then walking us through the main ""atrium"" to our table. It was very nice looking.We had the prix fixe menu which included several plates (four in total I believe, including cheese/dessert), and the accompanying wine tasters. The food was delicious! So fresh and local (the staff explained everything comes from their local greenhouse when able).The price was high, but we both agreed it was reflected in the quality and portions of the various plates.All in all, highly recommended!"
186003635,40,"November 26, 2013",Great service nice food,I've been here with a couple of business partners tonight and I must say we were pleasantly surprised with the great service. I rarely see such attention towards the dining customers. Most restaurants you really have to initiate contact with the serving personnel but here they were ahead of us each time.Food was nice and all organic made in their own greenhouse. It was nice but not mind blowing. I will go here again with my wife just because she loves biological food.
185527491,50,"November 22, 2013",An absolute stunner,"The service was fantastic, warm, engaging and VERY knowledgable. I loved having no menus, and just accepting the wonderful surprises served. The food is all based aroundcseasonalmngredins grown in the adjoining green houses.I wish this place was closer to home, but I'd go out of my way to revisit this place."
185439699,20,"November 21, 2013","Poor service, cold food and disinterested staff",Title says it all. Great setting but praise stops there. Took ages to get served. Food was cold when it arrived and waiters too interested in chatting to and serving adjacent table of single females. Totally failed to deliver on hype and expectations.
185431837,50,"November 21, 2013",Beautiful setting,"The setting and being able to eat in the greenhouse where most of the produce comes from is really a great concept. The service is fantastic, wonderful wine pairing, and the meal itself was very good. Definatly worth a try."
185225390,50,"November 19, 2013",English Couple - We highly recommend a visit!,"I wanted to make sure the weekend trip I organised was extra special for my Boyfriend's 30th Birthday. After weeks of researching, I came across De Kas on a number of websites. It came highly recommended and even ranked as one of the 'top 5 restaurants in Amsterdam'. Early booking was advised, so after emailing them directly with my reservation enquiry, I was pleased to hear from them confirming availability for Dinner. I explained it was for a birthday and was looking to arrange something special, they reassured me that this would be noted and a nice romantic table be set up for us. No advance deposit was required, just a request to email them the day before to confirm.Only a short tram ride, away from all the busy tourist areas was just perfect for us!! From the outside it's looks like a lovely old brick building with a very large fancy conservatory/green house on the side of it. Inside it's beautifully decorated, atmosphere is warm & welcoming not overly noisy nor cramped. The staff are so accommodating, they explain the menu thoroughly, consisting of 3 starters (to share) a main course each & then a dessert each all for approx 50 euros. The waiter staff also recommend the wine pairing to accompany the meal, and I would highly recommend you do this and at only approx 25 euro you get around 4 glasses each. We loved the fact that you didn't feel rushed in between courses and the food.....well....it was just fantastic! When the dessert arrived the Chef had decorated my boyfriends plate very sophisticatedly with ""Happy 30th Birthday"". What an enjoyable memorable birthday he had.Thank you De Kas.(P.s - it's certainly not the cheapest place, but you definitely get what you pay for!)"
185038630,50,"November 17, 2013",Beautiful setting,"The restaurant is set in the park and even walking into it is a lovely experience. We went in the evening and it was quite magical to see, the setting is beautiful. The service is very good everyone was attentive but not overbearing. The food is taken from their own gardens and if they don't have it they source it locally. The meal was very interesting with a variety of vegetables not usually found, such as purple potatoes and yellow carrots, very tasty ( I particularly enjoyed the beetroot ). I think it is slightly overpriced compared to some other meals I have had in Amsterdam, but the setting is unique, so I suppose that is what you are paying for. But it is worth a visit, especially for a special occasion."
184848062,50,"November 15, 2013",Sitting in the kitchen - a real experience,"I was lucky enough to eat at the Chef's table last week and thoroughly enjoyed the evening. After meeting Tommy, the head Chef, each Chef came to the table, introduced themselves and then explained what they had prepared for us. We had multiple small courses - each also accompanied by a selection of wines (each poured and described in detail).The food is grown in their own gardens and greenhouses and the chef takes what he has fresh and then decides what to put with it (fish, fowl etc). We enjoyed and very nice clear mushroom soup (served to the table in transparent tea pots), fresh salmon smoked on the premises, very slow roasted meats and, with them all, a selection of uncommon vegetables (the purple potatoes stand out in my mind).Between the main meal and dessert we had a tour around the restaurant and then enjoyed a selection of cheeses (one of which, a buffalo cheese, was made by the waitress's parents) and finally a very nice poached pear accompanied by ice-cream.I should mention the washer-up - he was a star and very entertaining. Also Martin - lovely guy."
184678711,50,"November 14, 2013",An experience not to be missed in Amsterdam,"Easily one of the best places I've been to. The setting is so unique and charming, they could have served card board and I would have loved it. :)But the food is also great.I love their menu: they have a ""lunch"" or ""dinner"" item. That's it. It's fresh in-season ingredients, mostly from their own garden, made into a dish created by the chef for that day. The food couldn't be more perfect.The restaurant is set on a the grounds of a park inside a green house. Great light in the dining room (it's all glass!), and great decor. Very nicely done.Their approach to service is also pleasantly relaxed (very un-American!); not inattentive, just relaxed. They were running around, but didn't make us feel like things were rushed. We sat there for 1.5 hours for lunch. They spaced out drinks, appetizers, and entrees so perfectly that it didn't really feel like 1.5 hours. I would generally be annoyed if my lunch took that long, but they made it feel right. And they were in no rush to get us out; we could have easily sat there for another half hour without anyone bothering us.Overall, I'd highly recommend this place for lunch or dinner in Amsterdam. It's a little pricey, but well worth the money."
184010317,50,"November 7, 2013",Great experience,Ate at the kitchen table last Thursday Food and service were incredible. chef Tommy was great at explaining each dish and sommelier Fabiane very knowledgable . One of the best dining experiences we have ever had. Highly recommend you pay a little extra to eat in the kitchen. This is a great place!
183816081,50,"November 6, 2013",Delicious,For wealthy cuisine lovers! For wealthy cuisine lovers! No food a la carte. Fixed menu with no choice. Full surprise. :)
183367310,50,"November 3, 2013",Unique experience,"Staff very friendly and helpful. Wine pairings very good. Not sure I would have chosen veal cheek, but it was very tasty. After dinner, the chef showed how the dish was prepared. Very open kitchen. Nice experience."
183173527,40,"November 1, 2013","Great atmosphere, authentic food, fantastic service","The food was very tasty, maybe 20 grams more per serving would suit our needs perfectly, great wines, especially their home made sparkling wine. You have to taste it. Very bio."
183150260,50,"November 1, 2013",wonderful!,"our experience at De Kas was simply wonderful. From the greeting at the door to the service and send-off, the staff was extremely kind and professional. The ambience is so serene, uplifting and warm. The daylight floods into the restaurant that is situated in a greenhouse, with a little pond, all you see is green. The food was delicious. We ventured in De Kas with two kids for lunch (with reservation of course) kind of concerned that the kids may not like the food. But it was really very good, the starters as well as the main dish. The check was also very reasonable. Overall we walked out fully satisfied. They even sent us off with organic apples as gifts."
182756394,50,"October 28, 2013",THE BEST MEAL IN AMSTERDAM,"from the atmosphere to the way they treated me this was a singularly INCREDIBLE experience.I took the tram by myself from dam square and when I arrived, I walked across a fairy tale bridge to what seemed like an oasis in the night.what greeted me was a warm and friendly staff, a one-of-a-kind dining room (huge greenhouse feel with hipness to spare) & the most beautifully fresh menu (most of which seemed grown on site)all parts of my meal were paired with exquisite wines, and every step was explained perfectly & looked after impeccably. when I passed on the final coffee (after cheese course AND dessert course) my GREAT server hasan, bagged up chocolate almonds & nougat for me to take home (and then he gave me a tour of the entire grounds....which have to be seen to be believed)too to bottom....AMAZING.if you eat one place when you come visit amsterdam....it HAS to beDE KAS!ps. best gluten free bread EVER"
182248150,50,"October 24, 2013",Great time at the Chef's table,Really enjoyed dining at the Chef's table. The whole family enjoyed the theatre of the kitchen and loved the food too! Would recommend this as it was the best seat in the house.
182191813,50,"October 24, 2013",A unique dining experience,"Very different in many ways. The resturant is a 100 plus feet set back from the street so at night you feel very removed from the neighborhood. The greenhouse glass ceiling and lighting are warming. Food is seasonal and exceptionally fresh. Once you state items you won't eat such as pork or nuts, your choices are done. Each course was exceptional and flavors were well tuned to each other.The servers work well as a team and the tables are spaced for maximum comfort. Would absolutely will go back."
182078359,40,"October 23, 2013","Good food, nice ambiance, but expensive","There are two things special about this place, ""De Kas"", which means ""The Greenhouse"" in Dutch:1. It is in a greenhouse, where in certain parts (all kinds of) vegetables are still grown. This gives a very specific and nice ambiance2. Almost all food is grown by themselves, or by local sustainable and organic producersThe preparation of the food and the wines are of a high quality, and the service is fine and very very friendly as well.Only drawback is the price, 100 euro a person is easily spent for a diner."
181732966,50,"October 20, 2013",An amazing meal in an amazing space,"De Kas is a very special restaurant. It is set inside a massive greenhouse that once grew vegetables for the town. Part of the space is still used fro growing and you can walk through this fragrant garden. The greenhouse itself is set in a beautiful park. It is a truly magical setting. If you arrive before sunset you should stroll through the park first and then once you are seated in the restaurant watch the sky change from blue to pink to violet through the glass walls and ceiling. Once the sun has set the glass walls reflect the glow of candles on the tables, making it very romantic, There is an open kitchen so you can see the creative chefs at work. There is always a tasting menu using local produce from their own farm and green house and carefully sourced ingredients. The night we dined there it was a special vegetarian tasting menu with wine pairings for each course available. The cooking was creative, delicate and unique. De Kas is a bit of a splurge but well worth it to experience this lovely space and fine cuisine."
181385232,30,"October 17, 2013",Everything but the food had the wow factor,"I chose this restaurant to be the star of our short trip to Amsterdam. Given that my wife is a vegetarian I wanted her to have food that was thoughtfully prepared and cooked specifically for vegetarians. All the reviews and guide books indicated that this was a restaurant for 'foodies' and we were both looking forward to it. We caught the No. 9 tram which dropped you right outside the park, had a drink in the bar over the road because we were early and made our way to the restaurant. It is a stunning restaurant, very stylish and you immediately feel at home. The staff are young, attentive, very enthusiastic, very knowledgable and you could not wish for better service. We had wines as recommended for the courses which were terrific value and very good. Somehow and my wife said it first that the only thing we did not rave about was the food. It was well cooked and there was nothing wrong, but that was the point, neither did it have the wow factor either in taste or presentation. Given that this is not a cheap restaurant we somehow just expected more and were willing for there to be a course that we could rave about. It didn't happen which is a real shame given that the restaurant has everything going for it. The food simply didn't have the wow factor. That is not to say that we didn't have an enjoyable dining experience because we did, but for once in a top end restaurant the food was not at the top of the list of reasons to be cheerful. Sorry"
181170745,50,"October 15, 2013",Unforgettable experience,"The greenhouse is a must see in Amsterdam. We didn't dine excessively well during the three weeks we spent in Europe so this was a treat. The restaurant is in an heritage greenhouse in a nice spot of greenery outside central Amsterdam (we caught tram #9 from the Centraal Station, not complicated). The set menu is more of a gastronomic degustation, varying depending on the produce which is local or grown by the restaurant itself. We were olives and bread too start, then had three light but flavoursome starters, a small main (I had the vegetarian tarte tatin with beetroot, everyone else had fish) with plentiful vegetables and a lovely dessert (the verbena ice cream was particularly memorable), although a cheese board was available too. Thoroughly enjoyable and worth every cent, great service. Perfect location for a wedding, it was very light inside and we couldn't even tell it was overcast and raining outside."
180955300,40,"October 14, 2013","""Memorable Organic Meal""","Had two-course lunch at this beautiful greenhouse restaurant. De Kas has its own greenhouses and garden near the restaurant, where they grow Mediterranean vegetables, herbs and edible flowers and served it to the table. in love with this place and the staffs are professional yet attentive and friendly."
180665121,40,"October 12, 2013","beautiful greenery, food good","I had lunch with a friend a month ago. we walked there from the the docks( long long walk!), we took a tramway on the way back to the city centre ( 20 min). the place is beautiful, lots of light coming through the greenery ( Amsterdam's light, you won't get roasted). as we arrived to the restaurant, we walked through the vegetable garden which is beautiful ; obviously enough, at least for anyone who has experience of vegetable growing, their own supply cannot cover the demand of such a restaurant, but it's good they use their herbs and what they can, anyway. the service is nice and attentive without being fussy and I appreciated it very much. The food: I remember I had some fish, with vegetables ( some pumpkin maybe?); I remember very well that I was pleased with my lunch and had a very nice time. but I can't remember what I actually ate, so I would say the food is fresh and good but not memorable. If in Amsterdam again, I would go back because my experience was very pleasant overall and the place is worth a visit."
179178018,50,"September 30, 2013",The best meal & experience I've ever had!,"Friends had told me about Da Kas, when I googled it and found the web site, I was fairly certain I was in love with these people and their concept for food, flavours and hospitality. The concept was includes a three-course tasting menu (fixed) which can often be problematic for the girl with allergies. I emailed to see if they could work around my allergies? The immediately responded letting me know that it wouldn't be a problem.A lovely man named Enno arrived to ask if we might enjoy an apero of champagne, a sparkling Riesling from the Netherlands. ""A Riesling, but then technically it's not champagne"". He concurred and let us know it was dry, not sweet, so we agreed to try it. Who knew Riesling could be so good?! They offered us delicious olives, roasted celeriac, a house made basil oil with sourdough rolls and ...(what was in that four little bowl) with our apero.I asked Enno if we might talk about my allergies to which he replied ""Yes, the kitchen is fully aware of your , you are allergic to all fish, nuts, mushrooms, melon, bananas... and the gloves made of latex"". I think my jaw dropped open and my friend replied ""That's incredible""!Chef Tommy, this great English guy came to our table with our starters and began with ""We really appreciate it when guests let us know about their dietary concerns, so thank you"". Wow, when does that ever happen? Usually, I feel like I've inconvenienced the kitchen or comprimised the chef's creativity or worse, they ignore me and think I'm just being picky. My love for Da Kas is swelling!We both started with soup of this tiny, rare potato (kate has the name written down) with fennel, flowers, greens mustard and dried, toasted onion. Tommy told us how to make the toasted onion and I can't wait to try it. Enno, paired the soup and my second starter with a lovely Bio white from the region. The soup was incredible and the wine pairing, perfect!Our second starter began with a beet root, roasted tomatoes and prosciutto for me and Kate's had beets and melon in hers, both were topped with a beet root puree which was delicious and went well with the bio white Enno had recommended.I looked at Tommy unsure about the third starter since I wasn't a fan of eggs and I never ate anything fried. He told me he could make me something different, but assured me that the egg was fired in sunflower oil and there was no possible cross contamination. I decided I was willing to give it a go. The egg was incredible! It tasted like fluffy goodness with roasted carrots and turnips. Enno had paired this starter with a rose of mostly malbec grapes, so a little darker in color. Kate's third course was a white fish (forget what) that was apparently delicious and paired well with the second white she received.Red arrived for our main course ... Tommy came out to share we would be having porc on a bed of roasted sweet potatoes and fennel, toasted pumpkin seeds, more greens and flowers and an incredible drizzle! Porc ranks bottom on the list of meats I would prefer to eat, I'd pick nearly any other gamey & fowl friends (lapin, canard or agneau) above porc, but again I was willing to give this a go! The delicious piece of perfectly cooked, saignante piece of meat in front of me, neither looked liked or tasted like ""the other white meat"" I've had in the UK or France. It was tender and delicious.Tommy came out to check on us at some point and I asked how long he had been at Da Kas? ""Well, like you I came here for dinner two years ago with my brother who was living in Amsterdam and I was so impressed ... "" I interrupted, you decided to go to culinary school? He laughed. ""No, but I went back to his apartment, printed out my CV and came back the next day. They hired me on the spot. And to tell you, kitchens can be, well difficult places to work. Here, everyone is great, like family and I'm given the opportunity to experiment and have fun doing what I love."" When I asked what Tommy might like to do in the future, he told me he was quite happy but ""Some day, I might like to go back to England to be close to family and to start something like this, where the food is inspired by what is fresh and prepared from the land. We're fortunate right now, over 80% of the ingredients are from our farms and greenhouses, come winter it's more difficult to have such variety.We decided that while we were fully satisfied we had room for the third course of dessert. The Dutch know how to pace a meal. We were presented a lovely lemon tart with house-made meringue, vanilla and berries.My love for Da Kas is about to grow exponentially! In between Enno and Tommy tending to our care, several other delightful staffers delivered, engaged and provided treats to our table. We were also given a bowl of caramelized white chocolate and cookies with our espresso.Enno ordered us a taxi and we prepared to depart, giving Tommy and the kitchen staff our regards and deep appreciation. :-> As Enno walked us to the door, he offered us apples from a giant bowl we'd passed on the way in.This was hands down the best dining experience ever!!! It was not fussy, over done, over priced or over the top. It was perfect from the first email exchange to our send off some three hours later. (LOVE +100)"
178642474,50,"September 25, 2013",Organically fresh,I found this restaurant googling gluten free eating. What a lovely place. You eat at the greenhouse where many ingredients you eat are grown. The meal starts with apps and drinks in the gardens and follows with a meal in the greenhouse which is soooo airy. Everything is so fresh and they rose to my challenge of a few food allergy issues.
178580452,50,"September 25, 2013",Truly memorable,"My best friend had her wedding here and it was fantastic. how can you NOT like dining in a gorgeous greenhouse where beautiful food is growing everywhere? I still remember how incredible the cucumbers tasted, 4 years later.I highly recommend this place for a wedding. it gave me a lasting impressing of Amsterdam."
177855365,40,"September 19, 2013",Unique restaurant,"My husband and I had lunch at De Kas to celebrate his birthday. The experience was unique and the greenhouse effect was nice. While the food was nothing too fancy/memorable, it was not bad. The service was great and location/garden interesting. Definitely worth a visit for the experience."
177695763,30,"September 18, 2013",We were not as impressed as many others seem to be.,"The theory is compelling: grow your own organic veggies and try to stay with locally sourced foods. We thought that for the most part the meals here were overpriced and lacking in taste. Clearly, others feel differently, but for my taste stick with Elsa's Cafe across the street at the tram stop. It's fun to take a tour of the greenhouse while you wait for your table. The location in a public park is sorta rural, and the enormous greenhouse where much of the produce is grown, is an easy-to-find landmark. Take the #9 tram from Centraal Station."
177506856,50,"September 17, 2013",Best food fantastic environment!,"Fresh organic food grown on the premises. The set menu is based on what they can get fresh that day, and the wine matches were superb. Up there with any dining experience I've had in the world. The decor was amazing too, like eating in a greenhouse, and the service and staff were excellent."
177043377,50,"September 13, 2013",Food right out of the garden,Beautiful conservatory. Grow their own food or source it locally. Three course prix fix dinner. They serve whatever is in season and avaiable.It is a special occasion restaurant that ius a foodie's paradise
175756612,50,"September 4, 2013",Home-grown food,"A prix-fixe dinner. A little pricy, but the service was excellent, food prepared well and presented well. Get there early, ask to see the ""garden hot house and the outdoor garden"" where the veggies are grown (also grown out-of-town), ask why the brick chimney is still attached to the hot-house style building."
