Id,Score,Date,Title,Review
798058056,10,"July 19, 2021",Poor communication,"Poor communication towards freelancers. Not reliable, unreasonable and very arrogant. Would not recommend this place."
796220834,50,"July 8, 2021",Fabulous,"After an hour drive from Makkum in the Friesland province meandering through the eye catching landscape of the Netherlands finds the rural giving way to the urban landscape of Amsterdam. The walk to this hidden gem of an establishment is well worth it - from the lush gardens to the mellow ambience of the interior. Very much a plant based lunch, the convivial De Kas team add that extra appeal. Despite only opening at 12pm, our online 12:15pm booking was certainly needed with all tables full an hour or so later although you wouldn't know with the cavernous ceiling masking the general hullabaloo. De Kas is doing everything right in a most unassuming way - long may it continue. Goed gedaan"
792789843,50,"June 16, 2021",Nice Restaurant,"If you go for 6 dishes they appear to have a weekly menu of 6 options and the restaurant will serve 4 of these on any given evening. The order comes in random apart from one which is a main which is just before the 2 deserts. The amuse bouches were very very nice as were all the mains. We had a lovely deserts especially the goats cheese cheesecake. Onlyu minor gripe was waiting a little while for a bottle of wine at one point but really thats me really reaching out and trying to find any flaws with the evening. Would highly recommend. Anyone wants to know how much, 2 oysters, 6 course meal, 2 glasses of wine, a bottle of wine (all at the low end price range) came to around 100 Euros a person. I have eaten in a lot of hi end restaurants and this was more than reasonable. 5 stars highly recommended."
788354190,50,"May 9, 2021",Absolutely Delicious Food,"My new favorite restaurant in Amsterdam!It prides itself on serving creative and absolutely delicious food mostly grown on site or at their farm, complemented by some meat and seafood sourced sustainably. But at the same time, they have no issue to cater for vegetarians or any other requests.You also get extremely attentive service, that is friendly, efficient and can provide great recommendations.I can't wait to be back again very soon!"
778227856,50,"November 30, 2020",So fresh! So tasty!,Ingredients were freshly picked from the garden of the restaurant. Each dish was beautifully arranged and tasted so good. Warm and attentive service throughout the dinner.
776539041,50,"November 5, 2020",Wonderful vegetarian food - a must visit,"Truly an awesome vegetarian experience. The food is exceptional, and the ""greenhouse"" environment is out of this world. One of the best vegetarian restaurants anywhere."
773167483,50,"October 5, 2020",Just have one word for it: excellent!!,"We had a fantastic dinner, they took the Corona measurements very seriously and we felt safe all the way, the tables are set far apart in a very large restaurant. The staff was wearing masks the whole evening.De kas, greenhouse in English, delivers when it comes to food and service. Amazing tasty dishes for a more than fair price. We ate at Michelin star restaurants before and we left amazed thinking why this has not received one. We will come back 100%"
772583624,50,"September 30, 2020",Really fancy place to eat!,Extremely beautiful inside the glasshouse. Service is outstanding and waiters have good knowledge about dietary restrictions like vegan food and food allergies.
772499627,20,"September 30, 2020",Disappoiting experience,"I read the incredible positive reviews and I had very high expectations.... unfortunately not met at all.Hygiene and COVID prevention: very low. The waiters are not wearing a mask or gloves and they are coming to your table and speak to you at a very close distance.Food: some products were quite repetitive ( poor choice in a menu' that you cannot choose) and the flavors were mostly or totally absent or incredibly heavy. The brot with olives was embaressing....incredibly fat and bitter.Artichokes with thorns and a dish with almost raw pumpkin really not eatable.The amuses were fine, the bread very tasty, the dessert interesting.....I find it inappropriate to let customers pay for tab water.The service was nice and friendly, but no respect of COVID rules either in the kitchen or in the service.Honestly, after this experience, I would not come back to this place and I would not recommend it."
771311025,50,"September 21, 2020",Greenhouse Dining Experience,"Located in a greenhouse in a park, this incredible garden/green-centered restaurant that produces their own produce (some of which you can see happening).The food was fresh, bursting with flavor, and presented beautifully. I found the staff to be friendly and helpful, which only added to the overall fun vibe. Also, since they have vegan options, I am eager to take some of my friends back later this year for the experience."
770692986,10,"September 16, 2020",Total disregard for hygiene standards,"This is a beautiful and very special restaurant serving amazingly delicious food. No question. BUT: I was appalled that in Covid times, neither the kitchen staff nor the waiters were wearing masks.. Worse: The waiters still come to the table and explain every detail of the respective dish they were serving. Six courses, six different waiters, all spraying their breath over the food. This restaurant has a high chance of becoming the next super-spreader. Totally irresponsible."
770436565,40,"September 15, 2020","Nice fresh products, great location","The food was nice and fresh, and the surrounding is amazing. Service was rather good too. Some more aromatics could have been added to the dishes in our view, and some of the dishes had repetitive elements (eg: fried fish/seaweed). The starter was very light and simple.A bit disappointed about some of the local/environmental friendly aspects eg: use of UV lights to grow plants (high energy use), offering sparkling or flat water before suggesting tap water (which ended up being charged at 4 euros as well!).Still interesting flavours and lots of amuses in addition to the fixed menu. Delicious bread too!"
770198500,50,"September 13, 2020","Fresh, tasty and beautifully presented food","This restaurant is located in a park in the south of Amsterdam easily reachable by tram from the centre. The restaurant is a massive green house in which they also produce a lot of their own vegetable and herbs. There’s also a gorgeous vegetable garden around the building. Food is fresh, full of flavour and beautifully presented. Staff are friendly and extremely helpful. This is the second time I’ve visited and they never fail to impress."
764380901,10,"August 12, 2020",Long curly hair in the food,"We were really looking forward to our dinner at this restaurant and the place is beautiful, presentation was amazing however when I got to my third course which wa a stuffed zucchini I had to pull out of my throat a massive long Curley hair!! It was awful and ruined the rest of the experience, we had about 4 more courses on top and I couldn’t even eat them and enjoy them because that long hair stuffier in the zucchini was disgusting!! I want to say I would come back but the staff didn’t even apologize or do any compensation for this, instead we got a bill that was over £200. I have to say I didn’t expect they will treat us like this after this experience. We won’t be coming back. For high end place like this you would expect some sort of compensation."
762348700,40,"July 31, 2020",Restaurant De Kas - Local Affinity!,"Local Affinity!The menu tells the story of the garden. Supplemented with some fish or meat, the vegetables play the main role. Harvested from the land in the morning, served in the afternoon. The most beautiful and freshest vegetables, from plant to plate as quickly as possible (...)The lunch consisted of the following ingredients:cabbage - mullet - plums - zucchini - vanilla - beurre blanc - plaice - vadouvan - cardamom - endive - samphireAnd the result was a taste exploitation in our mouth, local flavours pure! Completed with a fine Pinot Noir Rosé sparkling wine as starter, from the south of the Netherlands and during the lunch itself, we had a delicious Pinot Noir Rosé from Austria.The service was excellent and informed us perfectly about the ingredients of each course.During good weather you can sit outside on the terrace with a beautiful view into their garden. And do not forget to take a walk through the garden after your lunch or dinner."
761620227,50,"July 26, 2020",AMAZING lunch,"I Went for an AMAZING lunch here with my family when they came to visit this week. I will be forever recommending this place to my friends and family and can not wait to go back. Everything from start to finish was spectacular, within 5 minutes of walking through the door we were sat at our table, in the beautiful greenhouse, with a glass of Dutch sparkling wine & our table was covered in plates of delicious, fresh snacks from the greenhouse. It only got better from there and every single wine pairing was perfect.They score perfect marks in every category here!"
759487444,50,"July 9, 2020",Wonderfull evening,"Very pleasant evening with overall good food some verging to the outstanding levels. Balanced and well priced wine list and friendly, attentive yet non-intrusive service. Recommended."
757911421,50,"June 21, 2020",My new favourite restaurant in Amsterdam,What a great place! The location in the Wertheim Parc is amazing. All their food is local and fresh. Staff is Very friendly and down to earth. Can’t say more then just: go here for a great expirience!
757796508,50,"June 20, 2020",5 stars,"My girlfriend and I really enjoyed this restaurant. The concept of it, the style, the food and the service, all make it a great experience. It’s the perfect place to start a romantic evening."
757391848,50,"June 14, 2020",Exquisite tastes and pure freshness,"I went there on 1 June for my birthday. The restaurant host was careful to ask us to use hand gel before entering and asked us about our health. I felt safe about its coronavirus measures.The tables inside were quite spaced out and we were greeted with an array of amuses bouches which were delicious. Every course after that was a delightful surprise and the way they combined the ingredients was very creative. The dishes all looked so beautiful they were like pieces of art.I loved the greenhouse as well where one could see the vegetables, herbs and edible flowers that would eventually be in your dishes."
757030613,50,"June 7, 2020",You're eating the best of the best fresh from the garden,"We chose this restaurant as THE ONE we wanted to go to as soon as social distancing regulations were lifted for eatings spots in the country. They have beautifully created space and ambiance that both feels safe and is equally beautiful. The food was divine, incredible, surprising, appealing and original. The service was A+."
750983252,50,"March 15, 2020",Would highly recommend!,We were recommended De Kas by a friend who comes to Amsterdam regularly and we were so glad we booked a table - lovely restaurant in a beautiful green house - great and friendly service and food was outstanding.We had oysters to start - Thai style - they were delicious!Mainly vegetarian with some fish and great wineMake sure you book in advance!
750160456,50,"March 9, 2020",We loved everything about it.,Six adults and a two year old enjoyed a leisurely lunch on a rainy weekday afternoon. The architecture was special to begin with and when you add the excellent service and world class food to the equation you’ve got something very special. The waitstaff made sure the toddler was entertained with little nibbles of this and that. And the adults were entertained with a thorough description of each unusual and delicious course. Top drawer experience top to bottom.
749552772,50,"March 6, 2020",Simply exquisite,"Amazing food, dining experience, extraordinary flavours and outstanding service. Highly recommended to book in advance. Can't go wrong."
748865871,50,"March 3, 2020",SUPER GREENHOUSE! SUPER FOOD! SUPER SERVICE,"We have been going to Amsterdam every February for around 10 years. 2020 was our last visit as the Exhibition at the RAI is moving to Barcelona in 2021. We wanted to do somethings we had not done before to make our last trip memorable. We had lunch at Restaurant De Kas. It was a good walk from our hotel and the weather was not ideal and we did get a little wet, but on arrival at De Kas we were welcomed warmly and our coats put to dry. The venue is fabulous, a large green house but nothing like a garden greenhouse. Super sleek solar panels, auto opening roof, sleek and elegant but not over stated, friendly service and the food, well that was brilliant. Modern twists, beautifully presented, super tastes and the price wasn't too bad at all for what we got. All 4 of us had a fabulous time there. Would love to go back in the Summer when there is more growing in the gardens. All the food is either from the garden (obviously limited in Feb) or from local organic growers. Really hit my foodie fancies this place did!"
748506837,50,"March 1, 2020",The best food we had in a month!,"We ate at de Kas a few days ago as we were flying home and had an evening in Amsterdam. Getting out of our Uber and seeing the glowing greenhouse out in the Park was beautiful! Are we in the right place??? Yes! The restaurant is beautiful, an old greenhouse refurbished with lovely glasswork hanging above and an exposed kitchen. A little of the produce is grown onsite, but most at their farm some distance away. The menu follows a tasting format and changes weekly to reflect what is coming in from the farm. Siegfried, our waiter, was a delight and we loved the way each course was explained to us. When our next course was ready, any of the wait staff would bring it out. Watching the kitchen from our table close by was a delight and a lesson in how hard the kitchen works and the dance of cooking staff to delivery of our courses to our table. The food was excellent and very creative, with dishes using ingredients which we had never seen together. Our waiter told us at the end of the night that the restaurant had just won “Best Organic Restaurant in Amsterdam”, beating out a Michelin three star for the third year in a row! Wow! It was a fantastic evening!"
748101149,50,"February 28, 2020","Stunning, locally sourced ingredients in a unique setting","We had the set lunch at De Kas and it was comfortably one of the best dining experiences I have ever had. All the ingredients are super fresh and put together by very talented chef's into creative, incredibly tasty dishes. The flavour they extract out of the veg and herbs grown on site is just increible. The staff are knowledgable, friendly and very attentive and the ambiance is just wonderful. The tables are set in a big atrium, with loads of natural light and a real feeling of spaciousness. We had such a great meal."
746724985,50,"February 22, 2020",Interesting and Innovative Food,"On our last 3 visits to Amsterdam, we have dined at De Kas -- that says something! And on this most recent trip, we were not disappointed. The dinner is pris fixe and while they respect food allergies or foods you don't eat, your choice is whether you want the 5-course meal or the 6-course meal. We selected the 5-course meal with wine pairings and it was wonderful. It was very tasty in different (but not outre) ways and you did not leave ""stuffed"". They grow most of their own herbs and vegetables (some you can see as you enter the restaurant) and source the rest of the food mainly from local farmers in the Netherlands. They are very respectful of the environment. The setting -- a large green house -- is lovely and comfortable, the food remains wonderful, and the service is very respectful. On our next trip to Amsterdam, we will go back -- of course!"
746687416,50,"February 22, 2020",Amazing amazing restaurant!!,"Amazing amazing restaurant!! Food was some of the best I have tasted, and all made from same day picked fresh ingredients!! Our waitress was Fleur, and she really was lovely and attentive. And my girlfriend loved her birthday meal there. Was truly amazing!"
746502918,50,"February 21, 2020",best dinner,"We came here for dinner and the experience was mind blowing! the place is amazing and the dinner was perfect, we loved everything! the wine list is very cheap and the wine was delicious ! next time we will be in Amsterdam we will definitely come back!"
746148651,50,"February 19, 2020",Excellent and cozy,"Excellent food with an interesting twist in pleasant surroundings. The service was perfekt with very friendly persons, a very nice evening."
742686534,50,"February 2, 2020","Wonderful, inspirational, delicious","Wow, I cannot recommend this restaurant enough! Amazing knowledgeable staff and inspiring food. We had such an amazing time! Thank you"
741731641,50,"January 28, 2020",Perfectly delicious!,"It is outside central amsterdam but definitely worth going to. I like the fact that the restaurant is well lit because i like seeing clearly the food that i am eating, it is also spacious and its very cozy. We had the 6 course dinner and everything were perfect, its delicious and tasty. Everything was perfectly plated and interesting, there's this one dish that has salcify and i didn't even know what it was until now, all staffs were pleasant to us as well. We thoroughly enjoyed our visit and will be coming back soon!"
741353896,50,"January 26, 2020",Worth the bit of a trip,"Outside the central city, but worth the tram ride (line #19). Everything was perfectly balanced and perfectly tasty. They have their own greenhouse so you know everything is fresh. We ate here our last night and it was truly the culminating culinary experience of the trip."
738254917,50,"January 10, 2020",Amazing restaurant,We had lunch at De Kas restaurant.The restaurant located 15 minutes by car from the center.The food was amazing. The menu changed every day depends on the availability of the local produce.All the dishes we’re tasty include the desert.Highly recommend for people who wish to taste special flavors.
738202192,40,"January 9, 2020",Great food loved the ambience.,"Great food loved the ambience. Just loved the location of this restaurant. Very unique. Good cocktails, the food very seasonal very clean taste packed with flavour. Would recommend👍"
738044390,50,"January 9, 2020",Best farm to table lunch !!!,An amazing experience - beautifully prepared creative fresh food in a gorgeous greenhouse . Talk about farm to table!!!! Highlight of the trip .
737775731,50,"January 8, 2020",Amazing,"We went for dinner for my wife's bday and it was a great night.The wine was very good, and pretty much every dish was delicious. The cheese and the dessert were from out of this world.All ingredients are great quality, cooked to perfection and the flavours and textures are very crafted.The placer is not cheap, but in this case, I'm happy to pay the price because it is worthy if you enjoy good food."
736571361,50,"January 3, 2020","Healthy, regional and tasty","In this restaurant we had a wonderful menu for four persons and we really enjoyed this awesome dinner!The restaurant offers menus of their one vegetables and fruits and you can barely taste the freshness and the high quality of their own food.Our menu consists of five courses and every course had his own character and style. You can also order some cheese, which was great and they really tried to take care of allergens and other extra wishes.On top of that the room, in which we had the dinner, is really outstanding. The restaurant is a huge greenhouse, designers in a very stylish but elegant way.We also enjoyed the wonderful service with a charming waiter, who guided us trough the dinner and explained the food we had on our plates.Thanks for the wonderful evening and the impressive effort to offer healthy, regional and tasting food."
734939275,50,"December 27, 2019",Fantastic,"We took visitors here for lunch around the holidays and everyone loved their three-course meal, which was a great price for the excellent quality. The restaurant also did a great job with our request for a gluten-free menu as one of our party has celiac disease. The room is beautiful, too."
733060091,50,"December 16, 2019",Beautiful Dutch restaurant with their own produce,A restaurant located in a green house with delicious food. All dishes are made with their own produce or with ingredients from The Netherlands. The vegetarian option was super tasty. And the dessert was to die for! They just have tasting menus.
732901355,50,"December 15, 2019",Best Meal of the Vacation,This was everything you hoe for in field to table dining. The staff is extremely knowledgeable and friendly and the food phenomenal. Small multi course plates served with style and bold flavors. If you are a foodie this is your stop. Great European wines that don't break the budget and a flight to match with courses available. Take time to dine here.
731141978,50,"December 7, 2019",What a treat!,"Had an amazing meal here with friends. Loved the venue, food was exceptional and catered for dietary requirements well."
730132616,50,"December 1, 2019",Unique...truly farm to table....but slow service,"Overall, this was very good. The menu is literally a list of the ingredients they have from their garden to use in the 5 course pris fiixe meal. Beautiful restaurant...definitely worth it."
730070532,50,"December 1, 2019","Fresh & Local, Farm-to-Table, Innovative - A Great Culinary Experience","Traveling a great deal, we seek out the most innovative local cuisine and creative chefs everywhere. Everything about this place is amazing. It's a pre-fix, set menu. The setting is in a massive great house. Dining is elegant but very casual and comfortable. No need to dress up or act pretentious. No rush. Advance booking is necessary. It's a bit out of the way from the city center, but worth it. Uber can get you there and back in 15-20 minutes.The cuisine is always fresh and local, seasonal, responsibly sourced and presented as if it were fine art. Staff is charming and very helpful. Rarely see better."
729655979,50,"November 29, 2019",Unique and wonderful,"Had a very pleasant dinner with my teenage daughter. Every dish was an experience; interesting combination of ingredients on top of great service, definitely a must while in Amsterdam!"
728643560,50,"November 24, 2019",Highlight of our Amsterdam stay,"We booked private dining for our group of 30 at De Kas Restaurant. This was a perfect choice.The restaurant has a wonderful ambience, sitting in a large glasshouse. We had the set menu which was predominantly vegetarian, with some excellent gluten free alternatives.The food was truly exceptional, with 80% grown locally. We would thoroughly recommend this restaurant as part of your next visit to Amsterdam."
728380014,40,"November 23, 2019","Interesting food, so tasty","We had dinner on a Wednesday evening. It's a lovely space, a bit big and impersonal, but really nice. The food was fresh and interesting. The service was great for 3/5 courses - but then the servers seemed to disappear. That didn't bother us at all,except we skipped a course and it took forever to get the bill."
727525226,50,"November 19, 2019","Extraordinary food, service","Extraordinary food, service and ambience. While complex, the presentations are straightforward and lacking in the pretensions so common in high end restaurants nowadays. Each dish was creative, unique and delicious. I have rarely been in such a spacious restaurant. Service was friendly and helpful. One of the most memorable dining experiences for the last several years of travel around the world."
725198096,50,"November 9, 2019",Just wow. Birthday to remember.,"This place is one of the best restaurants I’ve ever visited. Just wow - yes, it was that good. It was an experience - from the restaurant setting itself to the presentation of the food to the taste.Everything was outstanding. All dishes were just exquisite.My girlfriend had a birthday to remember and we will certainly visit this place again if we are ever back in Amsterdam.Highly recommended."
724344218,50,"November 5, 2019",Excellent food in a very interesting setting,"Every dish was surprising and fantastic. You have to be fairly open minded as they served dishes that I would never order in a restaurant but there were flavours that I’ve never had before, which really was amazing.I was a bit worried that the price of drinks was going to be extortionate but was pleasantly surprised when we got the bill as it was very reasonable.Would recommend to anyone and will defiantly be coming backThank you"
723766057,50,"November 4, 2019",Fresh vegetables picked yards from your table.,"If your looking for something different and out of the usual tourist places, this is just for you. The setting, inside a smart greenhouse on the edge of Frankendael Park, is just perfect to appreciate the creative, tasty and highly sensory courses that are served and described expertly by a friendly waitress.I would definitely go back."
722158344,50,"October 28, 2019",Excellent. Make a reservation.,"Farm-to-table restaurant. De Kas is a special place, located inside of a park. Using farm fresh ingredients this fixed menu is fantastic - creative plating, tasty courses, highly sensory. This is dining, not fast food. Expect to spend time here enjoying dinner conversation and the food you eat. If you have any allergies, let the restaurant know in advance. They will fully accommodate tastes and preferences."
